{
  "$schema": "http://json-schema.org/draft-07/schema#",
  "title": "grammy_history_db.timeline_historical_eras",
  "description": "Formal MongoDB schema for timeline_historical_eras collection in grammy_history_db",
  "type": "object",
  "required": [
    "era_id",
    "era_name",
    "start_calendar_year",
    "end_calendar_year",
    "dominant_audio_format",
    "voting_tabulation_method",
    "predominant_music_genre",
    "total_ceremonies_contained",
    "headquarters_city",
    "industry_paradigm_shift_notes"
  ],
  "properties": {
    "era_id": {
      "type": "string",
      "description": "Domain attribute: era_id"
    },
    "era_name": {
      "type": "string",
      "description": "Domain attribute: era_name"
    },
    "start_calendar_year": {
      "type": "integer",
      "description": "Domain attribute: start_calendar_year"
    },
    "end_calendar_year": {
      "type": "integer",
      "description": "Domain attribute: end_calendar_year"
    },
    "dominant_audio_format": {
      "type": "string",
      "description": "Domain attribute: dominant_audio_format"
    },
    "voting_tabulation_method": {
      "type": "string",
      "description": "Domain attribute: voting_tabulation_method"
    },
    "predominant_music_genre": {
      "type": "string",
      "description": "Domain attribute: predominant_music_genre"
    },
    "total_ceremonies_contained": {
      "type": "integer",
      "description": "Domain attribute: total_ceremonies_contained"
    },
    "headquarters_city": {
      "type": "string",
      "description": "Domain attribute: headquarters_city"
    },
    "industry_paradigm_shift_notes": {
      "type": "string",
      "description": "Domain attribute: industry_paradigm_shift_notes"
    }
  },
  "additionalProperties": true
}