[
  {
    "era_id": "ERA_HISTORICAL_001",
    "era_name": "Golden Inception Era Part 1",
    "start_calendar_year": 1959,
    "end_calendar_year": 1967,
    "dominant_audio_format": "Vinyl LP & 45 RPM",
    "voting_tabulation_method": "Paper Ballot Tabulation",
    "predominant_music_genre": "Traditional Pop & Big Band",
    "total_ceremonies_contained": 9,
    "headquarters_city": "Santa Monica, California",
    "industry_paradigm_shift_notes": "Significant evolutionary era characterized by transition to Vinyl LP & 45 RPM."
  },
  {
    "era_id": "ERA_HISTORICAL_002",
    "era_name": "Rock Revolution Era Part 1",
    "start_calendar_year": 1968,
    "end_calendar_year": 1979,
    "dominant_audio_format": "Vinyl Stereo LP",
    "voting_tabulation_method": "Standard Scantron Tabulation",
    "predominant_music_genre": "Rock & Soul",
    "total_ceremonies_contained": 12,
    "headquarters_city": "Santa Monica, California",
    "industry_paradigm_shift_notes": "Significant evolutionary era characterized by transition to Vinyl Stereo LP."
  },
  {
    "era_id": "ERA_HISTORICAL_003",
    "era_name": "MTV & Compact Disc Era Part 1",
    "start_calendar_year": 1980,
    "end_calendar_year": 1999,
    "dominant_audio_format": "Digital Compact Disc (CD)",
    "voting_tabulation_method": "Audited Scantron Tabulation",
    "predominant_music_genre": "Pop & R&B",
    "total_ceremonies_contained": 20,
    "headquarters_city": "Santa Monica, California",
    "industry_paradigm_shift_notes": "Significant evolutionary era characterized by transition to Digital Compact Disc (CD)."
  },
  {
    "era_id": "ERA_HISTORICAL_004",
    "era_name": "Digital Download Era Part 1",
    "start_calendar_year": 2000,
    "end_calendar_year": 2014,
    "dominant_audio_format": "MP3 & Digital Downloads",
    "voting_tabulation_method": "Electronic Member Portal",
    "predominant_music_genre": "Hip-Hop & Electronic",
    "total_ceremonies_contained": 15,
    "headquarters_city": "Santa Monica, California",
    "industry_paradigm_shift_notes": "Significant evolutionary era characterized by transition to MP3 & Digital Downloads."
  },
  {
    "era_id": "ERA_HISTORICAL_005",
    "era_name": "Streaming Modern Era Part 1",
    "start_calendar_year": 2015,
    "end_calendar_year": 2025,
    "dominant_audio_format": "Spatial Audio & High-Res Streaming",
    "voting_tabulation_method": "Audited Cloud Voting Infrastructure",
    "predominant_music_genre": "Global & Diverse Genres",
    "total_ceremonies_contained": 11,
    "headquarters_city": "Santa Monica, California",
    "industry_paradigm_shift_notes": "Significant evolutionary era characterized by transition to Spatial Audio & High-Res Streaming."
  },
  {
    "era_id": "ERA_HISTORICAL_006",
    "era_name": "Golden Inception Era Part 2",
    "start_calendar_year": 1959,
    "end_calendar_year": 1967,
    "dominant_audio_format": "Vinyl LP & 45 RPM",
    "voting_tabulation_method": "Paper Ballot Tabulation",
    "predominant_music_genre": "Traditional Pop & Big Band",
    "total_ceremonies_contained": 9,
    "headquarters_city": "Santa Monica, California",
    "industry_paradigm_shift_notes": "Significant evolutionary era characterized by transition to Vinyl LP & 45 RPM."
  },
  {
    "era_id": "ERA_HISTORICAL_007",
    "era_name": "Rock Revolution Era Part 2",
    "start_calendar_year": 1968,
    "end_calendar_year": 1979,
    "dominant_audio_format": "Vinyl Stereo LP",
    "voting_tabulation_method": "Standard Scantron Tabulation",
    "predominant_music_genre": "Rock & Soul",
    "total_ceremonies_contained": 12,
    "headquarters_city": "Santa Monica, California",
    "industry_paradigm_shift_notes": "Significant evolutionary era characterized by transition to Vinyl Stereo LP."
  },
  {
    "era_id": "ERA_HISTORICAL_008",
    "era_name": "MTV & Compact Disc Era Part 2",
    "start_calendar_year": 1980,
    "end_calendar_year": 1999,
    "dominant_audio_format": "Digital Compact Disc (CD)",
    "voting_tabulation_method": "Audited Scantron Tabulation",
    "predominant_music_genre": "Pop & R&B",
    "total_ceremonies_contained": 20,
    "headquarters_city": "Santa Monica, California",
    "industry_paradigm_shift_notes": "Significant evolutionary era characterized by transition to Digital Compact Disc (CD)."
  },
  {
    "era_id": "ERA_HISTORICAL_009",
    "era_name": "Digital Download Era Part 2",
    "start_calendar_year": 2000,
    "end_calendar_year": 2014,
    "dominant_audio_format": "MP3 & Digital Downloads",
    "voting_tabulation_method": "Electronic Member Portal",
    "predominant_music_genre": "Hip-Hop & Electronic",
    "total_ceremonies_contained": 15,
    "headquarters_city": "Santa Monica, California",
    "industry_paradigm_shift_notes": "Significant evolutionary era characterized by transition to MP3 & Digital Downloads."
  },
  {
    "era_id": "ERA_HISTORICAL_010",
    "era_name": "Streaming Modern Era Part 2",
    "start_calendar_year": 2015,
    "end_calendar_year": 2025,
    "dominant_audio_format": "Spatial Audio & High-Res Streaming",
    "voting_tabulation_method": "Audited Cloud Voting Infrastructure",
    "predominant_music_genre": "Global & Diverse Genres",
    "total_ceremonies_contained": 11,
    "headquarters_city": "Santa Monica, California",
    "industry_paradigm_shift_notes": "Significant evolutionary era characterized by transition to Spatial Audio & High-Res Streaming."
  },
  {
    "era_id": "ERA_HISTORICAL_011",
    "era_name": "Golden Inception Era Part 3",
    "start_calendar_year": 1959,
    "end_calendar_year": 1967,
    "dominant_audio_format": "Vinyl LP & 45 RPM",
    "voting_tabulation_method": "Paper Ballot Tabulation",
    "predominant_music_genre": "Traditional Pop & Big Band",
    "total_ceremonies_contained": 9,
    "headquarters_city": "Santa Monica, California",
    "industry_paradigm_shift_notes": "Significant evolutionary era characterized by transition to Vinyl LP & 45 RPM."
  },
  {
    "era_id": "ERA_HISTORICAL_012",
    "era_name": "Rock Revolution Era Part 3",
    "start_calendar_year": 1968,
    "end_calendar_year": 1979,
    "dominant_audio_format": "Vinyl Stereo LP",
    "voting_tabulation_method": "Standard Scantron Tabulation",
    "predominant_music_genre": "Rock & Soul",
    "total_ceremonies_contained": 12,
    "headquarters_city": "Santa Monica, California",
    "industry_paradigm_shift_notes": "Significant evolutionary era characterized by transition to Vinyl Stereo LP."
  },
  {
    "era_id": "ERA_HISTORICAL_013",
    "era_name": "MTV & Compact Disc Era Part 3",
    "start_calendar_year": 1980,
    "end_calendar_year": 1999,
    "dominant_audio_format": "Digital Compact Disc (CD)",
    "voting_tabulation_method": "Audited Scantron Tabulation",
    "predominant_music_genre": "Pop & R&B",
    "total_ceremonies_contained": 20,
    "headquarters_city": "Santa Monica, California",
    "industry_paradigm_shift_notes": "Significant evolutionary era characterized by transition to Digital Compact Disc (CD)."
  },
  {
    "era_id": "ERA_HISTORICAL_014",
    "era_name": "Digital Download Era Part 3",
    "start_calendar_year": 2000,
    "end_calendar_year": 2014,
    "dominant_audio_format": "MP3 & Digital Downloads",
    "voting_tabulation_method": "Electronic Member Portal",
    "predominant_music_genre": "Hip-Hop & Electronic",
    "total_ceremonies_contained": 15,
    "headquarters_city": "Santa Monica, California",
    "industry_paradigm_shift_notes": "Significant evolutionary era characterized by transition to MP3 & Digital Downloads."
  },
  {
    "era_id": "ERA_HISTORICAL_015",
    "era_name": "Streaming Modern Era Part 3",
    "start_calendar_year": 2015,
    "end_calendar_year": 2025,
    "dominant_audio_format": "Spatial Audio & High-Res Streaming",
    "voting_tabulation_method": "Audited Cloud Voting Infrastructure",
    "predominant_music_genre": "Global & Diverse Genres",
    "total_ceremonies_contained": 11,
    "headquarters_city": "Santa Monica, California",
    "industry_paradigm_shift_notes": "Significant evolutionary era characterized by transition to Spatial Audio & High-Res Streaming."
  },
  {
    "era_id": "ERA_HISTORICAL_016",
    "era_name": "Golden Inception Era Part 4",
    "start_calendar_year": 1959,
    "end_calendar_year": 1967,
    "dominant_audio_format": "Vinyl LP & 45 RPM",
    "voting_tabulation_method": "Paper Ballot Tabulation",
    "predominant_music_genre": "Traditional Pop & Big Band",
    "total_ceremonies_contained": 9,
    "headquarters_city": "Santa Monica, California",
    "industry_paradigm_shift_notes": "Significant evolutionary era characterized by transition to Vinyl LP & 45 RPM."
  },
  {
    "era_id": "ERA_HISTORICAL_017",
    "era_name": "Rock Revolution Era Part 4",
    "start_calendar_year": 1968,
    "end_calendar_year": 1979,
    "dominant_audio_format": "Vinyl Stereo LP",
    "voting_tabulation_method": "Standard Scantron Tabulation",
    "predominant_music_genre": "Rock & Soul",
    "total_ceremonies_contained": 12,
    "headquarters_city": "Santa Monica, California",
    "industry_paradigm_shift_notes": "Significant evolutionary era characterized by transition to Vinyl Stereo LP."
  },
  {
    "era_id": "ERA_HISTORICAL_018",
    "era_name": "MTV & Compact Disc Era Part 4",
    "start_calendar_year": 1980,
    "end_calendar_year": 1999,
    "dominant_audio_format": "Digital Compact Disc (CD)",
    "voting_tabulation_method": "Audited Scantron Tabulation",
    "predominant_music_genre": "Pop & R&B",
    "total_ceremonies_contained": 20,
    "headquarters_city": "Santa Monica, California",
    "industry_paradigm_shift_notes": "Significant evolutionary era characterized by transition to Digital Compact Disc (CD)."
  },
  {
    "era_id": "ERA_HISTORICAL_019",
    "era_name": "Digital Download Era Part 4",
    "start_calendar_year": 2000,
    "end_calendar_year": 2014,
    "dominant_audio_format": "MP3 & Digital Downloads",